title,description,tags
Business Administration,"A broad major covering leadership, organizational behavior, strategy, operations, finance, and management for business roles.",management;leadership;strategy;operations;business
Accounting,"Focuses on financial reporting, auditing, taxation, budgeting, and the systems organizations use to track money.",accounting;finance;auditing;tax;reporting
Finance,"Covers investments, corporate finance, financial markets, risk management, and capital allocation decisions.",finance;investments;markets;risk;corporate-finance
Marketing,"Studies consumer behavior, branding, digital promotion, market research, and campaign strategy for products and services.",marketing;branding;consumer-behavior;advertising;research
Economics,"Examines how individuals, firms, and governments make choices under scarcity using data, models, and policy analysis.",economics;policy;markets;analysis;decision-making
Supply Chain Management,"Prepares students to manage logistics, procurement, inventory, transportation, and operational efficiency.",supply-chain;logistics;procurement;operations;planning
Entrepreneurship,"Centers on startup creation, business model design, venture planning, innovation, and launching new ventures.",entrepreneurship;startups;innovation;leadership;venture