title,description
Introduction to Python,An introduction to Python programming covering syntax, data structures, and basic algorithms. Great for beginners interested in software development and data analysis.
Data Structures and Algorithms,Core data structures (lists, trees, graphs) and algorithmic problem solving — essential for software engineering roles.
Machine Learning I,Introductory ML concepts including supervised learning, model evaluation, and practical examples using scikit-learn.
Human-Computer Interaction,Principles of HCI, user research, prototyping, and usability testing — useful for design-oriented careers.
UX Design Fundamentals,Foundations of user experience, visual design, and wireframing for product designers.
Databases and SQL,Relational databases, SQL queries, and basic schema design useful for data-focused roles.
Statistics for Data Science,Probability, statistics, and hypothesis testing foundations for data analysis and ML.
Web Development with Flask,Building web apps with Flask, REST APIs, and deploying simple services — practical for full-stack learning.