title,description,tags
Psychology,"A social science major focused on behavior, cognition, mental processes, and human development.",psychology;behavior;cognition;research;development
Sociology,"Studies groups, institutions, culture, inequality, and how social structures shape human life.",sociology;society;culture;inequality;institutions
Political Science,"Examines government systems, political behavior, public policy, international relations, and civic power.",political-science;government;policy;international-relations;civics
History,"Explores past events, societies, movements, and the forces that shaped the modern world.",history;civilizations;culture;analysis;time
Anthropology,"Focuses on human societies, cultures, evolution, and the study of people across time and place.",anthropology;culture;humanity;society;research
Education Studies,"Prepares students to understand learning, teaching, curriculum, and the systems that support education.",education;teaching;curriculum;learning;instruction
Criminology,"Analyzes crime, justice systems, law enforcement, and social factors related to public safety.",criminology;justice;crime;law;public-safety